{
  "schema_version": "sign-expert-review-batch-v1",
  "batch_id": "good1-mock-001",
  "gloss_id": "좋다1",
  "revision": "REVIEW_V1_0P3_MOCK",
  "created_at": "2026-08-08T00:00:00Z",
  "review_padding_sec": 0.3,
  "manifest_sha256": "ff9a3ee88c66bd0710edd449281faacd888b3ba534bb3d06d83eb8baf386fc7a",
  "candidates": [
    {
      "candidate_id": "GOOD1_MOCK_KEEP",
      "signer_id": "S-A",
      "session_id": "SESSION-MOCK-A",
      "source_archive_id": "ARCH-A",
      "source_member": "INTERNAL_ONLY",
      "camera_view": "FRONT",
      "handedness": "NOT_REVIEWED",
      "mock_case": "KEEP_ORIGINAL",
      "drive_file_id": null,
      "clip_filename": "GOOD1_MOCK_KEEP_REVIEW.mp4",
      "clip_sha256": "4646f5dc78826ca9438983b66cc938c8699aebdc9fc54a1bbd6bd67851e174f2",
      "clip_size_bytes": 99423,
      "clip_duration_sec": 0.8,
      "fps_mode": "CFR",
      "nominal_fps": 30.0,
      "frame_count": 24,
      "frame_pts_sec": [0.0, 0.033333, 0.066667, 0.1, 0.133333, 0.166667, 0.2, 0.233333, 0.266667, 0.3, 0.333333, 0.366667, 0.4, 0.433333, 0.466667, 0.5, 0.533333, 0.566667, 0.6, 0.633333, 0.666667, 0.7, 0.733333, 0.766667],
      "source_frame_pts_sec": [10.2, 10.233333, 10.266667, 10.3, 10.333333, 10.366667, 10.4, 10.433333, 10.466667, 10.5, 10.533333, 10.566667, 10.6, 10.633333, 10.666667, 10.7, 10.733333, 10.766667, 10.8, 10.833333, 10.866667, 10.9, 10.933333, 10.966667],
      "annotated_start_source_sec": 10.5,
      "annotated_end_source_sec": 10.7,
      "review_start_source_sec": 10.2,
      "review_end_source_sec": 11.0,
      "annotated_start_local_frame": 9,
      "annotated_end_local_frame": 15,
      "target_status": "PENDING_EXPERT_REVIEW"
    },
    {
      "candidate_id": "GOOD1_MOCK_MODIFY",
      "signer_id": "S-B",
      "session_id": "SESSION-MOCK-B",
      "source_archive_id": "ARCH-B",
      "source_member": "INTERNAL_ONLY",
      "camera_view": "FRONT",
      "handedness": "NOT_REVIEWED",
      "mock_case": "MODIFY_BOUNDARY",
      "drive_file_id": null,
      "clip_filename": "GOOD1_MOCK_MODIFY_REVIEW.mp4",
      "clip_sha256": "4646f5dc78826ca9438983b66cc938c8699aebdc9fc54a1bbd6bd67851e174f2",
      "clip_size_bytes": 99423,
      "clip_duration_sec": 0.8,
      "fps_mode": "CFR",
      "nominal_fps": 30.0,
      "frame_count": 24,
      "frame_pts_sec": [0.0, 0.033333, 0.066667, 0.1, 0.133333, 0.166667, 0.2, 0.233333, 0.266667, 0.3, 0.333333, 0.366667, 0.4, 0.433333, 0.466667, 0.5, 0.533333, 0.566667, 0.6, 0.633333, 0.666667, 0.7, 0.733333, 0.766667],
      "source_frame_pts_sec": [20.2, 20.233333, 20.266667, 20.3, 20.333333, 20.366667, 20.4, 20.433333, 20.466667, 20.5, 20.533333, 20.566667, 20.6, 20.633333, 20.666667, 20.7, 20.733333, 20.766667, 20.8, 20.833333, 20.866667, 20.9, 20.933333, 20.966667],
      "annotated_start_source_sec": 20.5,
      "annotated_end_source_sec": 20.7,
      "review_start_source_sec": 20.2,
      "review_end_source_sec": 21.0,
      "annotated_start_local_frame": 9,
      "annotated_end_local_frame": 15,
      "target_status": "PENDING_EXPERT_REVIEW"
    },
    {
      "candidate_id": "GOOD1_MOCK_MISMATCH",
      "signer_id": "S-C",
      "session_id": "SESSION-MOCK-C",
      "source_archive_id": "ARCH-C",
      "source_member": "INTERNAL_ONLY",
      "camera_view": "FRONT",
      "handedness": "NOT_REVIEWED",
      "mock_case": "TARGET_MISMATCH",
      "drive_file_id": null,
      "clip_filename": "GOOD1_MOCK_MISMATCH_REVIEW.mp4",
      "clip_sha256": "4646f5dc78826ca9438983b66cc938c8699aebdc9fc54a1bbd6bd67851e174f2",
      "clip_size_bytes": 99423,
      "clip_duration_sec": 0.8,
      "fps_mode": "CFR",
      "nominal_fps": 30.0,
      "frame_count": 24,
      "frame_pts_sec": [0.0, 0.033333, 0.066667, 0.1, 0.133333, 0.166667, 0.2, 0.233333, 0.266667, 0.3, 0.333333, 0.366667, 0.4, 0.433333, 0.466667, 0.5, 0.533333, 0.566667, 0.6, 0.633333, 0.666667, 0.7, 0.733333, 0.766667],
      "source_frame_pts_sec": [30.2, 30.233333, 30.266667, 30.3, 30.333333, 30.366667, 30.4, 30.433333, 30.466667, 30.5, 30.533333, 30.566667, 30.6, 30.633333, 30.666667, 30.7, 30.733333, 30.766667, 30.8, 30.833333, 30.866667, 30.9, 30.933333, 30.966667],
      "annotated_start_source_sec": 30.5,
      "annotated_end_source_sec": 30.7,
      "review_start_source_sec": 30.2,
      "review_end_source_sec": 31.0,
      "annotated_start_local_frame": 9,
      "annotated_end_local_frame": 15,
      "target_status": "PENDING_EXPERT_REVIEW"
    },
    {
      "candidate_id": "GOOD1_MOCK_UNUSABLE",
      "signer_id": "S-D",
      "session_id": "SESSION-MOCK-D",
      "source_archive_id": "ARCH-D",
      "source_member": "INTERNAL_ONLY",
      "camera_view": "FRONT",
      "handedness": "NOT_REVIEWED",
      "mock_case": "UNUSABLE",
      "drive_file_id": null,
      "clip_filename": "GOOD1_MOCK_UNUSABLE_REVIEW.mp4",
      "clip_sha256": "4646f5dc78826ca9438983b66cc938c8699aebdc9fc54a1bbd6bd67851e174f2",
      "clip_size_bytes": 99423,
      "clip_duration_sec": 0.8,
      "fps_mode": "CFR",
      "nominal_fps": 30.0,
      "frame_count": 24,
      "frame_pts_sec": [0.0, 0.033333, 0.066667, 0.1, 0.133333, 0.166667, 0.2, 0.233333, 0.266667, 0.3, 0.333333, 0.366667, 0.4, 0.433333, 0.466667, 0.5, 0.533333, 0.566667, 0.6, 0.633333, 0.666667, 0.7, 0.733333, 0.766667],
      "source_frame_pts_sec": [40.2, 40.233333, 40.266667, 40.3, 40.333333, 40.366667, 40.4, 40.433333, 40.466667, 40.5, 40.533333, 40.566667, 40.6, 40.633333, 40.666667, 40.7, 40.733333, 40.766667, 40.8, 40.833333, 40.866667, 40.9, 40.933333, 40.966667],
      "annotated_start_source_sec": 40.5,
      "annotated_end_source_sec": 40.7,
      "review_start_source_sec": 40.2,
      "review_end_source_sec": 41.0,
      "annotated_start_local_frame": 9,
      "annotated_end_local_frame": 15,
      "target_status": "PENDING_EXPERT_REVIEW"
    },
    {
      "candidate_id": "GOOD1_MOCK_RETRY",
      "signer_id": "S-E",
      "session_id": "SESSION-MOCK-E",
      "source_archive_id": "ARCH-E",
      "source_member": "INTERNAL_ONLY",
      "camera_view": "FRONT",
      "handedness": "NOT_REVIEWED",
      "mock_case": "NETWORK_RETRY",
      "drive_file_id": null,
      "clip_filename": "GOOD1_MOCK_RETRY_REVIEW.mp4",
      "clip_sha256": "4646f5dc78826ca9438983b66cc938c8699aebdc9fc54a1bbd6bd67851e174f2",
      "clip_size_bytes": 99423,
      "clip_duration_sec": 0.8,
      "fps_mode": "CFR",
      "nominal_fps": 30.0,
      "frame_count": 24,
      "frame_pts_sec": [0.0, 0.033333, 0.066667, 0.1, 0.133333, 0.166667, 0.2, 0.233333, 0.266667, 0.3, 0.333333, 0.366667, 0.4, 0.433333, 0.466667, 0.5, 0.533333, 0.566667, 0.6, 0.633333, 0.666667, 0.7, 0.733333, 0.766667],
      "source_frame_pts_sec": [50.2, 50.233333, 50.266667, 50.3, 50.333333, 50.366667, 50.4, 50.433333, 50.466667, 50.5, 50.533333, 50.566667, 50.6, 50.633333, 50.666667, 50.7, 50.733333, 50.766667, 50.8, 50.833333, 50.866667, 50.9, 50.933333, 50.966667],
      "annotated_start_source_sec": 50.5,
      "annotated_end_source_sec": 50.7,
      "review_start_source_sec": 50.2,
      "review_end_source_sec": 51.0,
      "annotated_start_local_frame": 9,
      "annotated_end_local_frame": 15,
      "target_status": "PENDING_EXPERT_REVIEW"
    }
  ]
}
